odm_agreement_schema,,,,,,,,
field_name,label,en,Context,th,km,vi,my,lo
title_translated,label,Contract Name,title_translated.label,ชื่อสัญญา,ឈ្មោះកិច្ចព្រមព្រៀង,Contract Name,စာချုပ်အမည်,ຊື່ສັນຍາ
title_translated,form_placeholder,Main title,title_translated.form_placeholder,หัวข้อหลัก,ចំណងជើងពេញ,Tiêu đề chính,အဓိကခေါင်းစဉ်,ຊື່ເອກະສານ
name,label,URL,name.label,URL,អាសយដ្ឋាន URL,URL,ယူအာရ်အယ်လ်,URL
notes_translated,label,Objective,notes_translated.label,วัตถุประสงค์,គោលបំណង,Objective,ရည်ရွယ်ချက်,ຈຸດປະສົງ
notes_translated,form_placeholder,Abstract or summary of book or article,notes_translated.form_placeholder,บทคัดย่อหรือเรื่องย่อของหนังสือหรือบทความ,សេចក្ដីសង្ខេបនៃសៀវភៅ ឬអត្ថបទ,Tóm tắt hoặc sơ lược cuốn sách hoặc bài viết,စာအုပ် သို့မဟုတ် ဆောင်းပါး၏ ကောက်နုတ်ချက် သို့မဟုတ် အကျဉ်းချုပ်,ບົດຄັດຫຍໍ້ ຫຼື ບົດສະຫຼຸບຂອງປຶ້ມ ຫຼື ບົດຄວາມ
odm_spatial_range,label,Geographic area (spatial range),odm_spatial_range.label,พื้นที่ทางภูมิศาสตร์ (ช่วงข้อมูล),តំបន់ភូមិសាស្រ្ត (ការលាតសន្ធឹងក្នុងលំហ),Vùng địa lý (phạm vi không gian),ပထဝီဧရိယာ (spatial range),ພື້ນທີ່ພູມສັນຖານ (ຂອບເຂດທີ່ຕັ້ງ)
odm_spatial_range,form_placeholder,"The geographic area that the dataset is relevant to (i.e. Cambodia, Laos).",odm_spatial_range.form_placeholder,พื้นที่ที่ชุดข้อมูลเกี่ยวข้อง (เช่น กัมพูชา ลาว เป็นต้น),"តំបន់ភូមិសាស្ត្រដែលជាប់ពាក់ព័ន្ធនឹងសំណុំទិន្នន័យ (ឧ.កម្ពុជា,ឡាវ) ។","Khu vực địa lý mà bộ dữ liệu có liên quan đến (ví dụ: Campuchia, Lào).",ဤအချက်အလက်အစုနှင့် သက်ဆိုင်သော ပထဝီဧရိယာ (ဆိုလိုသည်မှာ ကမ္ဘောဒီးယား၊ လာအို),"ພື້ນທີ່ພູມສັນຖານທີ່ກ່ຽວຂ້ອງກັບຊຸດຂໍ້ມູນ (ເຊັ່ນ ກຳປູເຈຍ, ລາວ)"
taxonomy,label,Topics,taxonomy.label,หัวข้อเรื่อง,ប្រធានបទ,Chủ đề,ခေါင်းစဉ်များ,ຫົວຂໍ້
taxonomy,form_placeholder,"e.g. economy, mental health, government",taxonomy.form_placeholder,เช่น เศรษฐศาสตร์ สุขภาพจิต รัฐบาล เป็นต้น,ឧ. សេដ្ឋកិច្ច សុខភាពផ្លូវចិត្ត និងរដ្ឋាភិបាល,"ví dụ: kinh tế, sức khỏe tinh thần, chính phủ",ဥပမာ စီးပွားရေး၊ စိတ်ကျန်းမာရေး၊ အစိုးရ,"ເຊັ່ນ ເສດຖະກິດ, ສຸຂະພາບຈິດ, ລັດຖະບານ"
odm_agreement_document_type,label,Document type,odm_agreement_document_type.label,ประเภทเอกสาร,ប្រភេទឯកសារ,Loại tài liệu,စာရွက်စာတမ်းအမျိုးအစား,ປະເພດເອກະສານ
odm_agreement_participating_share,label,Participating share,odm_agreement_participating_share.label,หุ้นส่วนแบบมีส่วนร่วม,ចូលរួមចែករំលែក,Tham gia chia sẻ,ပါဝင်နေသော အစုရှယ်ယာ,ຫຸ້ນບູລິມະສິດຮ່ວມ
odm_agreement_participating_share,form_placeholder,"Comma separated values with following format: company1, %
company2, %
company3, %",odm_agreement_participating_share.form_placeholder,"จุลภาค (,) แบ่งมูลค่าตามรูปแบบต่อไปนี้: บริษัท1, %
บริษัท2, %
บริษัท3, %","ប្រើសញ្ញាក្បៀសដើម្បីបញ្ជូលព័ត៌មានលើសពីមួយ៖ ក្រុមហ៊ុន1,%
ក្រុមហ៊ុន2,%
ក្រុមហ៊ុន3,%","Các giá trị được phân tách bằng dấu phẩy với định dạng sau: company1, %
company2, %
company3, %","ဤပုံစံအတိုင်း ကော်မာခံထားသော တန်ဖိုးဖော်ပြချက်များ - ကုမ္ပဏီ ၁, %
ကုမ္ပဏီ ၂,  %
ကုမ္ပဏီ ၃,  %","ໃຊ້ໝາຍຈຸດເພື່ອແຍກຄ່າຕາມຮູບແບບຕໍ່ໄປນີ້: ບໍລິສັດ1, %
ບໍລິສັດ2, %
ບໍລິສັດ3, %"
odm_agreement_contracting_parties,label,Contracting Parties,odm_agreement_contracting_parties.label,ภาคีคู่สัญญา,ភាគីនៃកិច្ចព្រមព្រៀង,Các bên ký kết,စာချုပ်ချုပ်ဆိုသော အဖွဲ့အစည်းများ,ຄູ່ສັນຍາ
odm_agreement_government_entity,label,Government Entity (multiple),odm_agreement_government_entity.label,หน่วยงานของรัฐ (หลายแห่ง),អង្គភាពរដ្ឋាភិបាល (ច្រើន),Đối tượng thuộc chính phủ (nhiều),သက်ဆိုင်ရာ အစိုးရ (မျိုးစုံ),ໜ່ວຍງານລັດຖະບານ (ຫຼາຍພາກສ່ວນ)
odm_agreement_government_entity,form_placeholder,The jurisdictional agency responsible for the enforcing and implementing the (law) legal document.,odm_agreement_government_entity.form_placeholder,หน่วยงานตุลาการรับผิดชอบบังคับใช้กฎหมาย,ភ្នាក់ងារសមត្ថកិច្ចដែលទទួលខុសត្រូវចំពោះការអនុវត្ត និងអនុវត្ត(ច្បាប់)ឯកសារច្បាប់ ។,Cơ quan pháp lý chịu trách nhiệm thi hành và thực thi văn bản pháp luật (luật).,(ဥပဒေ) ဥပဒေရေးရာစာရွက်စာတမ်း ပြဌာန်းရေးနှင့် အကောင်အထည်ဖော်ရေးအတွက်တာဝန်ရှိသော တရားစီရင်ပိုင်ခွင့်ရှိသည့် အဖွဲ့အစည်း,ອົງການນິຕິບັນຍັດທີ່ຮັບຜິດຊອບໃນການບັງຄັບໃຊ້ ແລະ ຈັດຕັ້ງປະຕິບັດເອກະສານທາງນິຕິກຳ (ກົດໝາຍ)
odm_agreement_concession_name,label,Concession/License name,odm_agreement_concession_name.label,ชื่อใบอนุญาต/สัมปทาน,ឈ្មោះសម្បទាន/អាជ្ញាប័ណ្ណ,Tên nhượng quyền/giấy phép,လုပ်ပိုင်ခွင့်/ ခွင့်ပြုချက် အမည်,ຊື່ສັນຍາສຳປະທານ/ໃບອະນຸຍາດ
odm_agreement_concession_name,form_placeholder,"The concession or license name, is meant for the name of the license area or block which is covered by the contract.",odm_agreement_concession_name.form_placeholder,ชื่อสัมปทานหรือใบอนุญาต คือชื่อพื้นที่หรือบล็อกที่ได้ใบอนุญาตซึ่งครอบคลุมโดยสัญญา,ឈ្មោះសម្បទាន ឬឈ្មោះអាជ្ញាប័ណ្ណ សំដៅលើឈ្មោះតំបន់ឬប្លុកដែលទទួលបានអាជ្ញាប័ណ្ណដែលមានចែងក្នុងកិច្ចសន្យា។,"Tên nhượng quyền hoặc giấy phép, có nghĩa là tên của khu vực  hoặc khối cấp phép có trong hợp đồng.",လုပ်ပိုင်ခွင့်/ ခွင့်ပြုချက် အမည် သည် စာချုပ်အရ ခွင့်ပြုထားသော နေရာ သို့မဟုတ် အကွက်၏အမည်ကို ဆိုလိုသည်။,ຊື່ສັນຍາສຳປະທານ/ໃບອະນຸຍາດ ໝາຍເຖິງຊື່ຂອງພື້ນທີ່ໂຄງການພາຍໃຕ້ສັນຍາສຳປະທານ.
odm_agreement_disclosure_mode,label,Disclosure Mode,odm_agreement_disclosure_mode.label,วิธีเปิดเผย,របៀបបង្ហាញព័ត៌មាន,Chế dộ tiết lộ,ထုတ်ဖော်ဖွင့်ပြမှု နည်းလမ်း,ຮູບແບບການເປີດເຜີຍຂໍ້ມູນ
odm_agreement_document_reference_number,label,Document reference no.,odm_agreement_document_reference_number.label,เลขอ้างอิงเอกสาร,លេខឯកសារយោង,Tài liệu tham khảo số, စာရွက်စာတမ်း ရည်ညွှန်းနံပါတ်,ເລກທີອ້າງອີງຂອງເອກະສານ
odm_agreement_document_reference_number,form_placeholder,Unknown default if not listed on the document.,odm_agreement_document_reference_number.form_placeholder,ไม่รู้จักค่าเริ่มต้น หากไม่ได้ระบุไว้ในเอกสาร,មិនស្គាល់លំនាំដើម បើមិនបានរាយក្នុងឯកសារ។,Mặc định chưa biết nếu không được liệt kê trên tài liệu.,စာရွက်စာတမ်းပေါ်တွင် စာရင်းမသွင်းထားပါက Unknown default ထားပါ။,"ຄ່າເລີ່ມຕົ້ນເປັນ 'ບໍ່ຮູ້ຈັກ', ຖ້າບໍ່ກຳນົດໃນເອກະສານ"
odm_agreement_landmatrix_no,label,LandMatrix deal No.,odm_agreement_landmatrix_no.label,เลขข้อตกลง LandMatrix,លេខកិច្ចសន្យាដី,Thỏa thuận LandMatrix số,LandMatrix ၏ ခွဲဝေမှုနံပါတ်,ເລກທີຂໍ້ສັນຍາຕາຕະລາງທີ່ດິນ
odm_agreement_landmatrix_no,form_placeholder,Look up land matrix number.,odm_agreement_landmatrix_no.form_placeholder,ค้นหาหมายเลขที่ดิน,ស្វែងរកលេខម៉ាទ្រីសដី,Tra cứu số land matrix.,Look up land matrix နံပါတ်,ກວດເບິ່ງເລກທີຕາຕະລາງທີ່ດິນ
license_id,label,License,license_id.label,ใบอนุญาต,អាជ្ញាប័ណ្ណ,Giấy phép,ခွင့်ပြုချက်,ສັນຍາລິຂະສິດ
license_id,help_text,License definitions and additional information can be found at http://opendefinition.org/,license_id.help_text,สามารถอ่านเพิ่มเติมนิยามใบอนุญาตและข้อมูลได้ที่ http://opendefinition.org/,និយមន័យអាជ្ញាប័ណ្ណ និងព័ត៌មានបន្ថែមអាចរកបាននៅ http://opendefinition.org/,Bạn có thể xem các định nghĩa cấp phép và thông tin bổ sung tại http://opendefinition.org/,ခွင့်ပြုချက်၏အဓိပ္ပာယ်နှင့် အခြားအချက်အလက်များကို http://opendefinition.org/ တွင် ဝင်ရောက်ကြည့်ရှုနိုင်ပါသည်။,ນິຍາມສັນຍາລິຂະສິດ ແລະ ຂໍ້ມູນເພີ່ມເຕີມສາມາດເບິ່ງໄດ້ທີ່ http://opendefinition.org/
odm_copyright,label,Copyright,odm_copyright.label,ลิขสิทธิ์,សិទ្ធិ,Bản quyền,မူပိုင်ခွင့်,ລິຂະສິດ
odm_copyright,help_text,"Select 'Yes', 'No', 'Unclear copyright' or 'To be determined' about the copyright of the dataset. If copyright of any type is present, describe further in Access and User Constraints.",odm_copyright.help_text,เลือก 'ใช่' 'ไม่ใช่' 'ใบอนุญาตไม่ชัดเจน' หรือ 'จะได้รับการพิจารณาภายหลัง' สำหรับลิขสิทธิ์ชุดข้อมูล ถ้าชุดข้อมูลมีกำหนดลิขสิทธิ์ประเภทใดประเภทหนึ่ง ให้อธิบายเพิ่มเติมในหัวข้อ ข้อจำกัดการเข้าถึงและผู้ใช้,"ជ្រើសរើសយក 'បាទ / ចាស', 'រក្សាសិទ្ធិមិនច្បាស់' ឬ 'នឹងត្រូវបានកំណត់' អំពីការរក្សាសិទ្ធិនៃសំណុំទិន្នន័យ។ ប្រសិនបើការរក្សាសិទ្ធិនៃប្រភេទណាមួយមានវត្តមាន, សូមពិពណ៌នាបន្ថែមទៀតនៅក្នុងកំហិតនៃការចូល និងប្រើប្រាស់។","Chọn 'Có', 'Không', 'Bản quyền không rõ ràng' hoặc 'Cần được xác định' về bản quyền của bộ dữ liệu. Nếu có bản quyền thuộc bất kỳ loại nào, hãy mô tả thêm trong Truy cập và ràng buộc các hành động của người dùng.",အချက်အလက်မူပိုင်ခွင့်အတွက် 'ရှိသည်'၊ 'မရှိပါ'၊ 'မရှင်းလင်းသော မူပိုင်ခွင့်' သို့မဟုတ် 'ဆုံးဖြတ်ရန်လိုအပ်သော' တို့ကို ရွေးချယ်ပါ။ အခြားပုံစံ မူပိုင်ခွင့်ရှိပါက အသုံးပြုခွင့်နှင့် အသုံးပြုသူ ကန့်သတ်ချက်များ ခေါင်းစဉ်အောက်တွင် နောက်ထပ် ဖော်ပြပါ။,"ເລືອກ 'ມີ', 'ບໍ່ມີ', 'ລິຂະສິດບໍ່ຈະແຈ້ງ', ຫຼື 'ຍັງບໍ່ກຳນົດ' ກ່ຽວກັບລິຂະສິດຂອງຊຸດຂໍ້ມູນ. ຖ້າມີລິຂະສິດ ໃຫ້ອະທິບາຍເພີ່ມເຕີມໃນຊ່ອງ ຂໍ້ຈຳກັດໃນການເຂົ້າເຖິງ ແລະ ນຳໃຊ້."
odm_access_and_use_constraints,label,Access and use constraints,odm_access_and_use_constraints.label,ข้อจำกัดการเข้าถึงและใช้งาน,កំហិតនៃការចូល និងប្រើប្រាស់,Hạn chế truy cập và sử dụng,ရယူခြင်းနှင့် အသုံးပြုခြင်း အကန့်အသတ်များ,ຂໍ້ຈຳກັດໃນການເຂົ້າເຖິງ ແລະ ນຳໃຊ້
odm_access_and_use_constraints,form_placeholder,A few sentences describing legal considerations for people who access the website and/or use its contents.,odm_access_and_use_constraints.form_placeholder,คำอธิบายเกี่ยวกับข้อควรรู้ด้านกฎหมายสำหรับผู้ใช้งานเว็บไซต์และ/หรือใช้เนื้อหา,សរសេរប្រយោគពីរបីឃ្លាដែលអធិប្បាយអំពីការពិចារណាផ្លូវច្បាប់សម្រាប់អ្នកដែលចូលប្រើគេហទំព័រនិង / ឬប្រើប្រាស់មាតិការបស់វា។,Một số câu mô tả các sự suy xét về pháp lý dối với những người truy cập trang web và/hoặc sử dụng nội dung của trang.,ဝက်ဘ်ဆိုက်အသုံးပြုခွင့်ရသူများ နှင့်/ သို့မဟုတ် ဝက်ဘ်ဆိုက်၏ အကြောင်းအရာများကို အသုံးပြုသူများအတွက် ဥပဒေရေးရာထည့်သွင်းစဉ်းစားချက်များကို ဖော်ပြသော ဝါကျအချို့,ອະທິບາຍຫຍໍ້ກ່ຽວກັບກົດລະບຽບທາງນິຕິກຳສຳລັບຜູ້ເຂົ້າຊົມ ແລະ ນຳໃຊ້ຂໍ້ມູນຂ່າວສານຈາກເວັບໄຊ.
owner_org,label,Organization,owner_org.label,องค์กร,អង្គភាព,Tổ chức,အဖွဲ့အစည်း,ອົງການຈັດຕັ້ງ
version,label,Version / Edition,version.label,เวอร์ชั่น / รุ่น,កំណែ/បោះពុម្ពលើកទី,Phiên bản/ Ấn phẩm,ပြင်ဆင်ချက်,ສະບັບທີ / ຄັ້ງທີ
version,form_placeholder,Version of publication,version.form_placeholder,เวอร์ชั่นสิ่งพิมพ์,កំណែនៃការបោះពុម្ព,Phiên bản xuất bản,ထုတ်ဝေမှုအကြိမ်,ສະບັບຂອງການຈັດພິມ
odm_language,label,Language of document,odm_language.label,ภาษาของเอกสาร,ភាសារបស់ឯកសារ,Ngôn ngữ của tài liệu,စာရွက်စာတမ်း၏ ဘာသာစကား,ພາສາຂອງເອກະສານ
odm_language,form_placeholder,"Language(s) of the dataset, including resources within dataset.",odm_language.form_placeholder,ภาษาของชุดข้อมูล รวมถึงทรัพยากรในชุดข้อมูล,ភាសា (ច្រើន) នៃសំណុំទិន្នន័យរួមបញ្ចូលទាំងធនធាននៅក្នុងសំណុំទិន្នន័យ។,"(Các) Ngôn ngữ của bộ dữ liệu, bao gồm các tài nguyên trong bộ dữ liệu.",အချက်အလက်အစုရှိ အရင်းအမြစ်များ အပါအဝင် အချက်အလက်အစု၏ ဘာသာစကား(များ),ພາສາຂອງຊຸດຂໍ້ມູນ ລວມທັງແຫຼ່ງຂໍ້ມູນພາຍໃນຊຸດຂໍ້ມູນ
odm_date_created,label,Date created,odm_date_created.label,วันที่สร้าง,កាលបរិច្ឆេទនៃការបង្កើត,Ngày tạo,ဖန်တီးသည့် ရက်စွဲ,ວັນທີສ້າງຊຸດຂໍ້ມູນ
odm_date_created,form_placeholder,Date a new version or update of the dataset was created.,odm_date_created.form_placeholder,วันที่สร้างชุดข้อมูลเวอร์ชั่นใหม่หรือชุดข้อมูลที่ได้ปรับปรุงแล้ว,កាលបរិច្ឆេទនៃការកែប្រែ ឬធ្វើបច្ចុប្បន្នភាពសំណុំទិន្នន័យដែលត្រូវបានបង្កើត,Ngày tạo phiên bản mới hoặc bản cập nhật của bộ dữ liệu.,အချက်အလက်အစု၏ ပြင်ဆင်ချက်အသစ် သို့မဟုတ် နောက်ဆုံးအခြေအနေ ကို ဖန်တီးသည့်ရက်စွဲ,ວັນທີສ້າງຊຸດຂໍ້ມູນທີ່ມີການປ່ຽນແປງ ຫຼື ປັບປຸງໃໝ່
odm_date_uploaded,label,Date uploaded,odm_date_uploaded.label,วันที่อัพโหลด,កាលបរិច្ឆេទនៃការដាក់បញ្ចូល,Ngày đăng tải,တင်သည့်ရက်စွဲ,ວັນທີອັບໂຫຼດ
odm_date_uploaded,form_placeholder,Date a new version or update of the dataset was uploaded.,odm_date_uploaded.form_placeholder,วันที่อัพโหลดชุดข้อมูลเวอร์ชั่นใหม่หรือชุดข้อมูลที่ได้ปรับปรุงแล้ว,កាលបរិច្ឆេទនៃការកែប្រែ ឬធ្វើបច្ចុប្បន្នភាពសំណុំទិន្នន័យដែលត្រូវបានដាក់បញ្ជូល។,Ngày phiên bản mới hoặc cập nhật của bộ dữ liệu được đăng tải.,အချက်အလက်အစု၏ ပြင်ဆင်ချက်အသစ် သို့မဟုတ် နောက်ဆုံးအခြေအနေ ကို တင်သည့်ရက်စွဲ,ວັນທີອັບໂຫຼດຊຸດຂໍ້ມູນທີ່ມີການປ່ຽນແປງ ຫຼື ປັບປຸງໃໝ່
odm_date_modified,label,Date modified,odm_date_modified.label,วันที่แก้ไข,កាលបរិច្ឆេទនៃការកែប្រែ,Ngày sửa đổi,ပြင်ဆင်သည့်ရက်စွဲ,ວັນທີແກ້ໄຂ
odm_date_modified,form_placeholder,Date a new version or update of the dataset was modified.,odm_date_modified.form_placeholder,วันที่แก้ไขชุดข้อมูลหรือปรับปรุงชุดข้อมูล,កាលបរិច្ឆេទនៃការកែប្រែ ឬធ្វើបច្ចុប្បន្នភាពសំណុំទិន្នន័យដែលត្រូវបានចូលទៅកែប្រែ,Ngày sửa đổi phiên bản mới hoặc cập nhật của bộ dữ liệu.,အချက်အလက်အစု၏ ပြင်ဆင်ချက်အသစ် သို့မဟုတ် နောက်ဆုံးအခြေအနေ ကို ပြင်ဆင်သည့်ရက်စွဲ,ວັນທີແກ້ໄຂຊຸດຂໍ້ມູນທີ່ມີການປ່ຽນແປງ ຫຼື ປັບປຸງໃໝ່
odm_province,label,Province(s),odm_province.label,จังหวัด,ខេត្ត (ច្រើន),(Các) Tỉnh,နယ်ပယ်,ແຂວງ
odm_province,form_placeholder,The province(s) this dataset relates to,odm_province.form_placeholder,จังหวัดในชุดข้อมูลนี้,ខេត្ត(ច្រើន)ដែលសំណុំទិន្នន័យនេះពាក់ព័ន្ធ,(Các) Tỉnh mà bộ dữ liệu này có liên quan,ဤအချက်အလက်အစုနှင့် သက်ဆိုင်သော နယ်ပယ်,ແຂວງທີ່ກ່ຽວຂ້ອງກັບຊຸດຂໍ້ມູນ
odm_metadata_reference_information,label,Metadata Reference Information,odm_metadata_reference_information.label,ข้อมูลอ้างอิงข้อมูลเมตา,ព័ត៌មានជាអំនះអំនាងនៃព័ត៌មាន,Thông tin tham khảo Metadata.,Metadata ကိုရည်ညွှန်းသော သတင်းအချက်အလက်,ຂໍ້ມູນອ້າງອີງຂອງ Metadata 
odm_metadata_reference_information,form_placeholder,Information about how up-to-date the metadata is and who is responsible for maintaining it.,odm_metadata_reference_information.form_placeholder,ข้อมูลเรื่องเมตาเดต้าทันสมัยมากแค่ไหนและใครรับผิดชอบในการดูแล,ព័ត៌មានអំពីបច្ចុប្បន្នភាពនៃព័ត៌មានអំពីទិន្នន័យ និងអ្នកដែលទទួលខុសត្រូវក្នុងការថែរក្សាវា។,Thông tin về cách cập nhật metadata và người chịu trách nhiệm duy trì.,metadata ၏နောက်ဆုံးအခြေအနေနှင့် ၎င်းကိုထိန်းသိမ်းရန်တာဝန်ရှိသူနှင့် သက်ဆိုင်သော သတင်းအချက်အလက်,ຂໍ້ມູນກ່ຽວກັບຄວາມທັນສະໄໝຂອງ metadata ແລະ ຜູ້ຮັບຜິດຊອບໃນການຄຸ້ມຄອງຮັກສາ.
